{
    "$schema": "http://json-schema.org/draft-07/schema#",
    "title": "Alien Ref Overview List",
    "type": "array",
    "items": {
      "type": "object",
      "properties": {
        "name": {
          "type": "string"
        },
        "source": {
          "type": "string"
        },
        "summary": {
          "type": "string"
        },
        "imgOverview": {
          "type": "string"
        }
      },
      "required": [
        "name",
        "source",
        "summary",
        "imgOverview"
      ]
    }
  }
  